{
  "schemaVersion": "1.0",
  "kind": "loopengineer.watcherInbox",
  "inbox_id": "watcher-inbox-26-a",
  "version": {
    "productVersion": "0.1.0",
    "protocolVersion": "1",
    "schemaVersion": "1.0",
    "skillContractVersion": "1"
  },
  "watcher_id": "watcher-26",
  "generated_at": "2026-06-15T09:45:00Z",
  "state_root": ".loopengineer/state/issue-26",
  "sources": [
    {
      "kind": "file",
      "locator": ".loopengineer/state/issue-26/scheduler-pool.json",
      "consumed": true
    }
  ],
  "summary": {
    "unconsumed_report_count": 1,
    "unconsumed_channel_event_count": 1,
    "unacked_instruction_count": 1,
    "stale_heartbeat_count": 1,
    "stale_channel_owner_count": 1,
    "candidate_unit_count": 1,
    "required_next_action_count": 1
  },
  "unconsumed_scheduler_reports": [
    {
      "report_id": "report-scheduler-26-progress",
      "scheduler_id": "scheduler-26",
      "unit_id": "unit-watcher-inbox",
      "report_path": ".loopengineer/state/issue-26/reports/report-scheduler-26-progress.json",
      "report_type": "progress_update",
      "created_at": "2026-06-15T09:40:00Z"
    }
  ],
  "unconsumed_channel_events": [
    {
      "event_id": "channel-event-26-request",
      "event_type": "request",
      "channel_id": "channel-contract",
      "scheduler_id": "scheduler-26",
      "event_path": ".loopengineer/state/issue-26/events/channel-event-26-request.json",
      "created_at": "2026-06-15T09:41:00Z"
    }
  ],
  "unacked_scheduler_instructions": [
    {
      "instruction_id": "watcher-instruction-26-a",
      "scheduler_id": "scheduler-26",
      "unit_id": "unit-watcher-inbox",
      "sent_at": "2026-06-15T09:30:00Z",
      "expected_report_type": "instruction_ack",
      "next_readback_at": "2026-06-15T09:45:00Z"
    }
  ],
  "stale_heartbeat_targets": [
    {
      "scheduler_id": "scheduler-26",
      "expected_thread_id": "thread-scheduler-26",
      "observed_thread_id": "thread-old-scheduler-26",
      "last_checked_at": "2026-06-15T09:44:00Z"
    }
  ],
  "stale_channel_owners": [
    {
      "channel_id": "channel-contract",
      "owner_scheduler_id": "scheduler-25",
      "stale_reason": "owner heartbeat target no longer matches scheduler thread",
      "next_readback_at": "2026-06-15T09:50:00Z"
    }
  ],
  "candidate_units": [
    {
      "unit_id": "unit-next-docs",
      "readiness": "ready",
      "source": {
        "kind": "github",
        "locator": "https://github.com/MC-and-his-Agents/LoopEngineer/issues/26",
        "consumed": true
      }
    }
  ],
  "required_next_actions": [
    {
      "owner": "watcher",
      "action": "consume scheduler report and channel request before deciding grant",
      "source": {
        "kind": "file",
        "locator": ".loopengineer/state/issue-26/reports/report-scheduler-26-progress.json",
        "consumed": false
      }
    }
  ],
  "next_action": {
    "owner": "watcher",
    "action": "read inbox locators before loading full artifacts",
    "status": "required"
  }
}
